{
  "$schema": "https://tinyzkp.com/schemas/tinyzkp-integrations.schema.json",
  "name": "TinyZKP Integrations",
  "url": "https://tinyzkp.com/integrations",
  "generated_at": "2026-06-24",
  "summary": "Integration surfaces for adding TinyZKP proof receipts to agents, backend APIs, SDK workflows, CLI scripts, browser verification, badges, and long-trace Compute.",
  "default_guidance": {
    "agent_workflows": "Use MCP first. Return an agent receipt envelope and receipt URL with high-value agent outputs. Use the agent-platform guide when proof receipts should become a native capability inside an agent runtime, IDE, workflow engine, or marketplace.",
    "backend_workflows": "Use REST, SDKs, or CLI. Keep API keys server-side and attach receipts to responses or checkpoints.",
    "recipient_verification": "Use the public verifier, hosted verification API, or compatible first-party WASM verifier path. Verification is free.",
    "large_traces": "Use Compute when trace size makes high-RAM prover infrastructure the bottleneck.",
    "data_boundary": "Do not put secrets, private customer data, or API keys into transparent receipt parameters."
  },
  "surfaces": [
    {
      "id": "mcp",
      "name": "MCP server",
      "status": "live",
      "best_for": "AI agents and agent runtimes that need native proof and verification tools.",
      "entrypoint": "https://mcp.tinyzkp.com",
      "docs": "https://tinyzkp.com/mcp",
      "install": "claude mcp add --transport http tinyzkp https://mcp.tinyzkp.com",
      "returns": "Proof job IDs, proof receipts, summaries, verification results, and capabilities."
    },
    {
      "id": "claude-code",
      "name": "Claude Code MCP guide",
      "status": "live",
      "best_for": "Claude Code users who want proof tools inside agentic development workflows.",
      "entrypoint": "https://mcp.tinyzkp.com",
      "docs": "https://tinyzkp.com/integrations/claude-code",
      "install": "claude mcp add --transport http tinyzkp https://mcp.tinyzkp.com",
      "returns": "Claude Code-accessible TinyZKP tools for proof generation, receipt retrieval, and verification."
    },
    {
      "id": "cursor",
      "name": "Cursor MCP guide",
      "status": "live",
      "best_for": "Cursor users adding proof receipts to agentic coding, backfill, migration, and review workflows.",
      "entrypoint": "https://mcp.tinyzkp.com",
      "docs": "https://tinyzkp.com/integrations/cursor",
      "install": "Add https://mcp.tinyzkp.com in Cursor's MCP server configuration with an Authorization header for proving.",
      "returns": "Cursor-accessible TinyZKP tools and receipt URLs for state-changing agent work."
    },
    {
      "id": "openai-agent-workflows",
      "name": "OpenAI-powered agent workflow guide",
      "status": "live",
      "best_for": "OpenAI-powered agent applications that need verifiable tool results and backend state-transition receipts.",
      "entrypoint": "https://api.tinyzkp.com",
      "docs": "https://tinyzkp.com/integrations/openai-agents",
      "install": "Use TinyZKP REST, SDKs, or MCP behind server-side tools that return structured agent results.",
      "returns": "Agent tool results with receipt URLs, verifier URLs, and explicit proof boundaries."
    },
    {
      "id": "rest",
      "name": "REST API",
      "status": "live",
      "best_for": "Backend services, edge workers, SaaS workflows, and server-owned proof submission.",
      "entrypoint": "https://api.tinyzkp.com",
      "docs": "https://tinyzkp.com/docs",
      "openapi": "https://tinyzkp.com/openapi.json",
      "returns": "Proof jobs, receipts, verification results, templates, estimates, and capabilities."
    },
    {
      "id": "python-sdk",
      "name": "Python SDK",
      "status": "live",
      "best_for": "Backend services, data pipelines, audit jobs, and operational scripts.",
      "install": "pip install tinyzkp",
      "docs": "https://tinyzkp.com/docs#sdks",
      "returns": "Typed API wrappers around the hosted proof and verification endpoints."
    },
    {
      "id": "typescript-sdk",
      "name": "TypeScript SDK",
      "status": "live",
      "best_for": "Node.js apps, edge workers, developer tooling, and receipt-aware web services.",
      "install": "npm install tinyzkp",
      "docs": "https://tinyzkp.com/docs#sdks",
      "returns": "JavaScript integration helpers for proof submission, polling, and verification."
    },
    {
      "id": "cli",
      "name": "CLI",
      "status": "live",
      "best_for": "Smoke tests, local workflows, support reproduction, and CI checks.",
      "install": "npx @tinyzkp/cli",
      "docs": "https://tinyzkp.com/docs#cli",
      "returns": "Command-line proof generation, polling, and verification output."
    },
    {
      "id": "browser-verifier",
      "name": "Browser verifier",
      "status": "live",
      "best_for": "Customer, auditor, and recipient verification without source-system access.",
      "entrypoint": "https://tinyzkp.com/verify",
      "docs": "https://tinyzkp.com/verify",
      "install": "npm install @tinyzkp/verify",
      "returns": "Verification result for pasted receipts or compatible local WASM verification."
    },
    {
      "id": "badges",
      "name": "Verified by TinyZKP badge",
      "status": "live",
      "best_for": "Customer-facing pages, audit records, dashboards, and receipt links.",
      "entrypoint": "https://tinyzkp.com/badges/verified-by-tinyzkp.svg",
      "docs": "https://tinyzkp.com/badges",
      "returns": "Embeddable badge asset linked to receipt verification."
    },
    {
      "id": "compute",
      "name": "Compute",
      "status": "live",
      "best_for": "Long supported state-transition traces, backfills, audit packages, and high-RAM prover alternatives.",
      "entrypoint": "https://tinyzkp.com/compute",
      "docs": "https://tinyzkp.com/compute",
      "pricing": "https://tinyzkp.com/pricing.json",
      "returns": "Usage-based long-trace proof receipts priced by trace step."
    }
  ],
  "related_assets": {
    "openapi": "https://tinyzkp.com/openapi.json",
    "examples": "https://tinyzkp.com/examples",
    "examples_metadata": "https://tinyzkp.com/examples.json",
    "limits": "https://tinyzkp.com/limits",
    "limits_metadata": "https://tinyzkp.com/limits.json",
    "fit": "https://tinyzkp.com/fit",
    "fit_metadata": "https://tinyzkp.com/fit.json",
    "evaluation": "https://tinyzkp.com/evaluation",
    "evaluation_metadata": "https://tinyzkp.com/evaluation.json",
    "roi": "https://tinyzkp.com/roi",
    "roi_metadata": "https://tinyzkp.com/roi.json",
    "template_catalog": "https://tinyzkp.com/templates",
    "template_metadata": "https://tinyzkp.com/templates.json",
    "mcp_metadata": "https://tinyzkp.com/mcp.json",
    "claude_code_integration": "https://tinyzkp.com/integrations/claude-code",
    "cursor_integration": "https://tinyzkp.com/integrations/cursor",
    "openai_agent_workflows": "https://tinyzkp.com/integrations/openai-agents",
    "agent_platforms": "https://tinyzkp.com/agent-platforms",
    "platform_rollout": "https://tinyzkp.com/platform-rollout",
    "platform_rollout_metadata": "https://tinyzkp.com/platform-rollout.json",
    "verifiable_agent_output": "https://tinyzkp.com/verifiable-agent-output",
    "agent_audit_trails": "https://tinyzkp.com/agent-audit-trails",
    "changelog": "https://tinyzkp.com/changelog",
    "changelog_metadata": "https://tinyzkp.com/changelog.json",
    "pricing_metadata": "https://tinyzkp.com/pricing.json",
    "calculator": "https://tinyzkp.com/calculator",
    "calculator_metadata": "https://tinyzkp.com/calculator.json",
    "enterprise": "https://tinyzkp.com/enterprise",
    "enterprise_metadata": "https://tinyzkp.com/enterprise.json",
    "agent_policy": "https://tinyzkp.com/agent-policy",
    "agent_policy_metadata": "https://tinyzkp.com/agent-policy.json",
    "discovery_metadata": "https://tinyzkp.com/discovery.json",
    "receipt_schema": "https://tinyzkp.com/schemas/tinyzkp-receipt.schema.json",
    "agent_receipt_schema": "https://tinyzkp.com/schemas/agent-receipt.schema.json",
    "recipes": "https://tinyzkp.com/recipes",
    "pilot_program": "https://tinyzkp.com/pilot"
  }
}
